{
  "schema_version": "sat-sim.scenario-baseline.v1",
  "baseline_id": "sat-sim.common-scenarios.v1",
  "status": "approved",
  "approval": {
    "status": "APPROVED",
    "reviewer": "project_owner",
    "reviewed_at_utc": "2026-07-29T00:00:00Z"
  },
  "claim_boundary": "Approved only as an internal engineering-simulation baseline for training and evaluation. This approval does not represent domain certification, real hardware validation, hardware calibration, flight qualification, or flight validation.",
  "basis_catalog": {
    "ADCS-FMEA": "Engineering FMEA categories: sensor bias/dropout and actuator authority/friction degradation.",
    "PROP-FMEA": "Engineering FMEA categories: valve/thruster failure, leakage and thrust or feed-pressure degradation.",
    "EPS-FMEA": "Engineering FMEA categories: open circuit, channel trip, capacity loss and conversion-efficiency degradation.",
    "THERMAL-FMEA": "Engineering FMEA categories: heater failure, thermal-path damage and emissivity or conductance degradation.",
    "PAYLOAD-FMEA": "Engineering FMEA categories: instrument shutdown, data corruption and sensitivity or throughput degradation.",
    "COMM-FMEA": "Engineering FMEA categories: link interruption, transmitter failure, storage overflow and gain or rate degradation.",
    "SYSTEM-FMEA": "Cross-subsystem resource, pointing, thermal, propulsion and communication propagation scenarios."
  },
  "performance_budget": {
    "pr_representative_max_s": 1800,
    "nightly_full_max_s": 21600,
    "case_timeout_s": 300,
    "max_parallel_cases": 4
  },
  "objects": [
    {"object_id":"whole_spacecraft","owner":"systems","basis_refs":["SYSTEM-FMEA"],"scenarios":{"nominal":[{"scenario_id":"whole.nominal_mission","name_zh":"整星正常任务运行","review_status":"approved"}],"fault":[{"scenario_id":"whole.subsystem_failure_propagation","name_zh":"分系统故障跨系统传播","review_status":"approved"}],"degradation":[{"scenario_id":"whole.resource_margin_degradation","name_zh":"整星资源裕度持续退化","review_status":"approved"}]}},
    {"object_id":"subsystem.adcs","owner":"adcs","basis_refs":["ADCS-FMEA"],"scenarios":{"nominal":[{"scenario_id":"adcs.nominal_pointing","name_zh":"正常姿态指向","review_status":"approved"}],"fault":[{"scenario_id":"adcs.actuator_or_sensor_failure","name_zh":"执行机构或敏感器故障","review_status":"approved"}],"degradation":[{"scenario_id":"adcs.pointing_authority_degradation","name_zh":"指向与控制能力退化","review_status":"approved"}]}},
    {"object_id":"subsystem.propulsion","owner":"propulsion","basis_refs":["PROP-FMEA"],"scenarios":{"nominal":[{"scenario_id":"propulsion.nominal_burn","name_zh":"正常推进点火","review_status":"approved"}],"fault":[{"scenario_id":"propulsion.thrust_or_feed_failure","name_zh":"推力或供给故障","review_status":"approved"}],"degradation":[{"scenario_id":"propulsion.performance_degradation","name_zh":"推进性能退化","review_status":"approved"}]}},
    {"object_id":"subsystem.eps","owner":"eps","basis_refs":["EPS-FMEA"],"scenarios":{"nominal":[{"scenario_id":"eps.nominal_power_balance","name_zh":"正常功率平衡","review_status":"approved"}],"fault":[{"scenario_id":"eps.generation_storage_distribution_failure","name_zh":"发电储能配电故障","review_status":"approved"}],"degradation":[{"scenario_id":"eps.energy_margin_degradation","name_zh":"能源裕度退化","review_status":"approved"}]}},
    {"object_id":"subsystem.thermal","owner":"thermal","basis_refs":["THERMAL-FMEA"],"scenarios":{"nominal":[{"scenario_id":"thermal.nominal_regulation","name_zh":"正常温度调节","review_status":"approved"}],"fault":[{"scenario_id":"thermal.heating_or_rejection_failure","name_zh":"加热或散热故障","review_status":"approved"}],"degradation":[{"scenario_id":"thermal.control_margin_degradation","name_zh":"热控裕度退化","review_status":"approved"}]}},
    {"object_id":"subsystem.payload","owner":"payload","basis_refs":["PAYLOAD-FMEA"],"scenarios":{"nominal":[{"scenario_id":"payload.nominal_observation","name_zh":"正常载荷观测","review_status":"approved"}],"fault":[{"scenario_id":"payload.instrument_failure","name_zh":"载荷仪器故障","review_status":"approved"}],"degradation":[{"scenario_id":"payload.quality_or_rate_degradation","name_zh":"观测质量或数据率退化","review_status":"approved"}]}},
    {"object_id":"subsystem.comm_data","owner":"comm_data","basis_refs":["COMM-FMEA"],"scenarios":{"nominal":[{"scenario_id":"comm_data.nominal_downlink","name_zh":"正常数据下传","review_status":"approved"}],"fault":[{"scenario_id":"comm_data.link_or_storage_failure","name_zh":"链路或存储故障","review_status":"approved"}],"degradation":[{"scenario_id":"comm_data.margin_or_throughput_degradation","name_zh":"链路裕度或吞吐退化","review_status":"approved"}]}},
    {"object_id":"component.antenna","owner":"comm_data","basis_refs":["COMM-FMEA"],"scenarios":{"nominal":[{"scenario_id":"antenna.nominal_gain","name_zh":"正常天线增益","review_status":"approved"}],"fault":[{"scenario_id":"antenna.pointing_loss","name_zh":"天线指向丢失","review_status":"approved"}],"degradation":[{"scenario_id":"antenna.gain_degradation","name_zh":"天线增益退化","review_status":"approved"}]}},
    {"object_id":"component.battery","owner":"eps","basis_refs":["EPS-FMEA"],"scenarios":{"nominal":[{"scenario_id":"battery.nominal_charge_discharge","name_zh":"正常充放电","review_status":"approved"}],"fault":[{"scenario_id":"battery.open_circuit","name_zh":"蓄电池开路","review_status":"approved"}],"degradation":[{"scenario_id":"battery.capacity_loss","name_zh":"蓄电池容量衰减","review_status":"approved"}]}},
    {"object_id":"component.cmg","owner":"adcs","basis_refs":["ADCS-FMEA"],"scenarios":{"nominal":[{"scenario_id":"cmg.nominal_torque","name_zh":"正常控制力矩输出","review_status":"approved"}],"fault":[{"scenario_id":"cmg.gimbal_lock","name_zh":"框架锁定","review_status":"approved"}],"degradation":[{"scenario_id":"cmg.torque_authority_loss","name_zh":"力矩能力退化","review_status":"approved"}]}},
    {"object_id":"component.data_queue","owner":"comm_data","basis_refs":["COMM-FMEA"],"scenarios":{"nominal":[{"scenario_id":"data_queue.nominal_flow","name_zh":"正常数据排队","review_status":"approved"}],"fault":[{"scenario_id":"data_queue.overflow","name_zh":"数据队列溢出","review_status":"approved"}],"degradation":[{"scenario_id":"data_queue.service_rate_degradation","name_zh":"队列服务速率退化","review_status":"approved"}]}},
    {"object_id":"component.fuel_tank","owner":"propulsion","basis_refs":["PROP-FMEA"],"scenarios":{"nominal":[{"scenario_id":"fuel_tank.nominal_feed","name_zh":"正常推进剂供给","review_status":"approved"}],"fault":[{"scenario_id":"fuel_tank.leak","name_zh":"燃料贮箱泄漏","review_status":"approved"}],"degradation":[{"scenario_id":"fuel_tank.feed_pressure_degradation","name_zh":"供给压力退化","review_status":"approved"}]}},
    {"object_id":"component.ground_station","owner":"comm_data","basis_refs":["COMM-FMEA"],"scenarios":{"nominal":[{"scenario_id":"ground_station.nominal_pass","name_zh":"正常地面过站","review_status":"approved"}],"fault":[{"scenario_id":"ground_station.unavailable","name_zh":"地面站不可用","review_status":"approved"}],"degradation":[{"scenario_id":"ground_station.receive_margin_degradation","name_zh":"地面接收裕度退化","review_status":"approved"}]}},
    {"object_id":"component.heater","owner":"thermal","basis_refs":["THERMAL-FMEA"],"scenarios":{"nominal":[{"scenario_id":"heater.nominal_switching","name_zh":"正常加热控制","review_status":"approved"}],"fault":[{"scenario_id":"heater.stuck_off","name_zh":"加热器断路或关断","review_status":"approved"}],"degradation":[{"scenario_id":"heater.power_degradation","name_zh":"加热功率退化","review_status":"approved"}]}},
    {"object_id":"component.imu","owner":"adcs","basis_refs":["ADCS-FMEA"],"scenarios":{"nominal":[{"scenario_id":"imu.nominal_measurement","name_zh":"正常惯性测量","review_status":"approved"}],"fault":[{"scenario_id":"imu.measurement_dropout","name_zh":"惯性测量中断","review_status":"approved"}],"degradation":[{"scenario_id":"imu.bias_noise_growth","name_zh":"偏置噪声增长","review_status":"approved"}]}},
    {"object_id":"component.link_budget","owner":"comm_data","basis_refs":["COMM-FMEA"],"scenarios":{"nominal":[{"scenario_id":"link_budget.nominal_margin","name_zh":"正常链路裕度","review_status":"approved"}],"fault":[{"scenario_id":"link_budget.link_outage","name_zh":"链路中断","review_status":"approved"}],"degradation":[{"scenario_id":"link_budget.margin_degradation","name_zh":"链路裕度退化","review_status":"approved"}]}},
    {"object_id":"component.magnetometer","owner":"adcs","basis_refs":["ADCS-FMEA"],"scenarios":{"nominal":[{"scenario_id":"magnetometer.nominal_measurement","name_zh":"正常地磁测量","review_status":"approved"}],"fault":[{"scenario_id":"magnetometer.dropout","name_zh":"磁强计失效","review_status":"approved"}],"degradation":[{"scenario_id":"magnetometer.bias_noise_growth","name_zh":"偏置噪声增长","review_status":"approved"}]}},
    {"object_id":"component.mtb","owner":"adcs","basis_refs":["ADCS-FMEA"],"scenarios":{"nominal":[{"scenario_id":"mtb.nominal_dipole","name_zh":"正常磁矩输出","review_status":"approved"}],"fault":[{"scenario_id":"mtb.coil_open","name_zh":"磁力矩器线圈开路","review_status":"approved"}],"degradation":[{"scenario_id":"mtb.dipole_capacity_loss","name_zh":"磁矩能力退化","review_status":"approved"}]}},
    {"object_id":"component.onboard_storage","owner":"comm_data","basis_refs":["COMM-FMEA"],"scenarios":{"nominal":[{"scenario_id":"onboard_storage.nominal_buffering","name_zh":"正常星上存储","review_status":"approved"}],"fault":[{"scenario_id":"onboard_storage.overflow","name_zh":"星上存储溢出","review_status":"approved"}],"degradation":[{"scenario_id":"onboard_storage.capacity_degradation","name_zh":"存储容量退化","review_status":"approved"}]}},
    {"object_id":"component.payload","owner":"payload","basis_refs":["PAYLOAD-FMEA"],"scenarios":{"nominal":[{"scenario_id":"payload.nominal_operation","name_zh":"正常载荷工作","review_status":"approved"}],"fault":[{"scenario_id":"payload.shutdown","name_zh":"载荷异常关机","review_status":"approved"}],"degradation":[{"scenario_id":"payload.throughput_degradation","name_zh":"载荷吞吐退化","review_status":"approved"}]}},